Kode,Emiten,Tahun_IPO,Saham_Beredar,Papan_Pencatatan
WEGE,Wijaya Karya Bangunan Gedung T,2017,9572000000,Utama
WEHA,WEHA Transportasi Indonesia Tb,2007,1460554819,Utama
WGSH,Wira Global Solusi Tbk.,2021,1042500000,Akselerasi
WICO,Wicaksana Overseas Internation,1994,2393710348,Pemantauan Khusus
WIDI,Widiant Jaya Krenindo Tbk.,2023,1600009029,Akselerasi
WIFI,Solusi Sinergi Digital Tbk.,2020,2359355118,Utama
WIIM,Wismilak Inti Makmur Tbk.,2012,2099873760,Utama
WIKA,Wijaya Karya (Persero) Tbk.,2007,8969951372,Utama
WINE,Hatten Bali Tbk.,2023,2710000000,Pengembangan
WINR,Winner Nusantara Jaya Tbk.,2022,5235283825,Pemantauan Khusus
WINS,Wintermar Offshore Marine Tbk.,2010,4364337057,Utama
WIRG,WIR ASIA Tbk.,2022,11938622394,Pengembangan
WMPP,Widodo Makmur Perkasa Tbk.,2021,29419000000,Pemantauan Khusus
WMUU,Widodo Makmur Unggas Tbk.,2021,12941176500,Pemantauan Khusus
WOMF,Wahana Ottomitra Multiartha Tb,2004,3481481480,Utama
WOOD,Integra Indocabinet Tbk.,2017,6437500000,Utama
WOWS,Ginting Jaya Energi Tbk.,2019,2475720000,Pemantauan Khusus
WSBP,Waskita Beton Precast Tbk.,2016,54555721325,Pemantauan Khusus
WSKT,Waskita Karya (Persero) Tbk.,2012,28806807016,Pemantauan Khusus
WTON,Wijaya Karya Beton Tbk.,2014,8715466600,Utama
YELO,Yelooo Integra Datanet Tbk.,2018,1912774405,Pemantauan Khusus
YPAS,Yanaprima Hastapersada Tbk,2008,668000089,Pemantauan Khusus
YULE,Yulie Sekuritas Indonesia Tbk.,2004,1785000000,Pemantauan Khusus
ZATA,Bersama Zatta Jaya Tbk.,2022,8496000000,Pemantauan Khusus
ZBRA,Dosni Roha Indonesia Tbk.,1991,2510706263,Pengembangan
ZINC,Kapuas Prima Coal Tbk.,2017,25250000000,Pemantauan Khusus
ZONE,Mega Perintis Tbk.,2018,870171478,Pengembangan
ZYRX,Zyrexindo Mandiri Buana Tbk.,2021,1333334556,Pengembangan
